{
  "$schema": "./provenance-manifest.schema.json",
  "version": 3,
  "inventory_source": "docs/provenance/source-backed-inventory.md",
  "policy_note": "The public field represents allowed public visibility under the remediation policy. current_runtime_visibility records whether a chart is still rendered on the public site before remediation changes are applied. phase_2_target_contract captures the approved replacement dataset contract for charts that remain illustrative at runtime after Phase 1. phase_3_target_contract captures the approved post-remediation methodology contract for the remaining derived charts whose current runtime implementation is still unresolved after Phase 2.",
  "charts": [
    {
      "id": "overview.gdp-waterfall",
      "page": "overview",
      "route": "/",
      "placement": "grid-card-1",
      "component": "GdpWaterfall",
      "endpoint": "/api/v1/gdp/components",
      "current_source_claim": "Source: BEA Contributions to Real GDP Growth · Q4 2025",
      "current_runtime_visibility": "public",
      "public": true,
      "methodology_type": "source_backed",
      "freshness_cadence": "quarterly",
      "methodology_note_required": false,
      "phase_1_requirement": "dynamic_payload_attribution",
      "remediation_status": "phase_1_dynamic_attribution",
      "upstream_sources": [
        {
          "provider": "BEA via FRED",
          "dataset": "NIPA Table 1.1.2 Contributions to Percent Change in Real Gross Domestic Product",
          "kind": "stored_series",
          "notes": "Stored quarterly contribution component series directly back consumer spending, business investment, government, net exports, and inventory bars."
        }
      ],
      "storage_locations": [
        {
          "layer": "postgres.economic_series",
          "reference": "Quarterly GDP component contribution observations stored per source series"
        },
        {
          "layer": "postgres.series_metadata",
          "reference": "Metadata rows for the approved GDP contribution component series"
        }
      ],
      "phase_3_target_contract": {
        "public": true,
        "methodology_type": "source_backed",
        "freshness_cadence": "quarterly",
        "methodology_note_required": false,
        "source_claim_template": "Source: BEA Contributions to Real GDP Growth · Q<quarter> <year>",
        "upstream_sources": [
          {
            "provider": "BEA via FRED",
            "dataset": "NIPA Table 1.1.2 Contributions to Percent Change in Real Gross Domestic Product",
            "kind": "stored_series",
            "notes": "Stored contribution component series should back consumer spending, business investment, government, net exports, and inventory bars directly."
          }
        ],
        "storage_locations": [
          {
            "layer": "postgres.economic_series",
            "reference": "Quarterly GDP component contribution observations stored per source series"
          },
          {
            "layer": "postgres.series_metadata",
            "reference": "Metadata rows for the approved GDP contribution component series"
          }
        ]
      }
    },
    {
      "id": "overview.gdp-quarterly",
      "page": "overview",
      "route": "/",
      "placement": "grid-card-2",
      "component": "GdpQuarterly",
      "endpoint": "/api/v1/gdp/quarterly",
      "current_source_claim": "Source: BEA · Q4 2025",
      "current_runtime_visibility": "public",
      "public": true,
      "methodology_type": "source_backed",
      "freshness_cadence": "quarterly",
      "methodology_note_required": false,
      "phase_1_requirement": "dynamic_payload_attribution",
      "remediation_status": "phase_1_dynamic_attribution",
      "upstream_sources": [
        {
          "provider": "BEA via FRED",
          "dataset": "A191RL1Q225SBEA",
          "kind": "stored_series"
        }
      ],
      "storage_locations": [
        {
          "layer": "postgres.economic_series",
          "reference": "A191RL1Q225SBEA observations"
        },
        {
          "layer": "postgres.series_metadata",
          "reference": "A191RL1Q225SBEA metadata row"
        }
      ]
    },
    {
      "id": "overview.cpi-calendar",
      "page": "overview",
      "route": "/",
      "placement": "grid-card-3",
      "component": "CpiCalendar",
      "endpoint": "/api/v1/cpi/calendar",
      "current_source_claim": "Source: BLS · Jan 2026",
      "current_runtime_visibility": "public",
      "public": true,
      "methodology_type": "source_backed",
      "freshness_cadence": "monthly",
      "methodology_note_required": false,
      "phase_1_requirement": "dynamic_payload_attribution",
      "remediation_status": "phase_1_dynamic_attribution",
      "upstream_sources": [
        {
          "provider": "BLS via FRED",
          "dataset": "CPIAUCSL",
          "kind": "stored_series",
          "notes": "YoY values are calculated from stored CPI observations at response time."
        }
      ],
      "storage_locations": [
        {
          "layer": "postgres.economic_series",
          "reference": "CPIAUCSL observations"
        },
        {
          "layer": "postgres.series_metadata",
          "reference": "CPIAUCSL metadata row"
        }
      ]
    },
    {
      "id": "overview.economic-funnel",
      "page": "overview",
      "route": "/",
      "placement": "grid-card-4",
      "component": "EconomicFunnel",
      "endpoint": "/api/v1/labor/funnel",
      "current_source_claim": "Source: BEA, BLS · Q4 2025",
      "current_runtime_visibility": "public",
      "public": true,
      "methodology_type": "derived",
      "freshness_cadence": "mixed",
      "methodology_note_required": true,
      "phase_1_requirement": "dynamic_payload_attribution",
      "remediation_status": "phase_3_methodology_note",
      "upstream_sources": [
        {
          "provider": "BEA via FRED",
          "dataset": "Gross Domestic Product; Gross National Income; Compensation of employees",
          "kind": "stored_series",
          "notes": "Stored quarterly GDP, GNI, and compensation series define the first three funnel stages directly."
        },
        {
          "provider": "BLS via FRED",
          "dataset": "All Employees, Total Nonfarm",
          "kind": "stored_series",
          "notes": "The final stage uses the latest stored PAYEMS month inside the aligned quarter and converts thousands of persons into millions."
        }
      ],
      "storage_locations": [
        {
          "layer": "postgres.economic_series",
          "reference": "Quarterly GDP/GNI/compensation observations plus monthly PAYEMS observations used to build aligned funnel stages"
        },
        {
          "layer": "postgres.series_metadata",
          "reference": "Metadata rows for GDP, A023RC1Q027SBEA, COE, and PAYEMS"
        },
        {
          "layer": "backend_service",
          "reference": "backend/app/services/labor_funnel.py"
        }
      ],
      "phase_3_target_contract": {
        "public": true,
        "methodology_type": "derived",
        "freshness_cadence": "mixed",
        "methodology_note_required": true,
        "source_claim_template": "Source: BEA, BLS · <latest aligned period>",
        "transformation_summary": "Build the funnel from stored GDP, gross national income, compensation, and employment inputs with documented unit conversions and stage mapping rather than fixed share assumptions.",
        "upstream_sources": [
          {
            "provider": "BEA via FRED",
            "dataset": "Gross Domestic Product; Gross National Income; Compensation of employees",
            "kind": "stored_series",
            "notes": "Stored national income inputs should define the first three funnel stages directly."
          },
          {
            "provider": "BLS",
            "dataset": "Employment series used for the workforce stage",
            "kind": "stored_series",
            "notes": "The final stage should use a stored labor input instead of inferring workforce impact from GDP shares."
          }
        ],
        "storage_locations": [
          {
            "layer": "postgres.economic_series",
            "reference": "Quarterly and monthly national income / labor inputs used by the funnel stages"
          },
          {
            "layer": "postgres.series_metadata",
            "reference": "Metadata rows for approved funnel input series"
          },
          {
            "layer": "backend_service",
            "reference": "Backend-owned funnel methodology mapping and unit conversions"
          }
        ]
      }
    },
    {
      "id": "overview.bullet-targets",
      "page": "overview",
      "route": "/",
      "placement": "grid-card-5",
      "component": "BulletTargets",
      "endpoint": "/api/v1/kpi/summary",
      "current_source_claim": "Source: BEA, BLS, Federal Reserve · Mar 10, 2026",
      "current_runtime_visibility": "public",
      "public": true,
      "methodology_type": "derived",
      "freshness_cadence": "mixed",
      "methodology_note_required": true,
      "phase_1_requirement": "dynamic_payload_attribution",
      "remediation_status": "phase_3_methodology_note",
      "upstream_sources": [
        {
          "provider": "Stored dashboard KPI inputs",
          "dataset": "GDP, CPIAUCSL, UNRATE, FEDFUNDS",
          "kind": "stored_series",
          "notes": "Chart measures, target bands, and markers are derived from stored KPI inputs plus backend-owned policy definitions in the shared summary response."
        }
      ],
      "storage_locations": [
        {
          "layer": "postgres.economic_series",
          "reference": "GDP, CPIAUCSL, UNRATE, FEDFUNDS observations"
        },
        {
          "layer": "postgres.series_metadata",
          "reference": "GDP, CPIAUCSL, UNRATE, FEDFUNDS metadata rows"
        },
        {
          "layer": "backend_service",